{
  "$schema": "https://json-schema.org/draft/2020-12/schema",
  "$id": "https://open-content-engine.example/schemas/artifacts/setup-frame.schema.json",
  "title": "Setup Frame",
  "description": "The guided-setup FRAME emitted by engine/setup/flow.computeFrame and surfaced by `engine setup --json`. This is the PUBLISHED CONTRACT a host-runtime adapter (e.g. a Discord component renderer) consumes to draw the changing setup menu: where the operator is on the C0–C4 ladder, what is still needed (the verifier's failing checks + remediation), and the actions available now. The engine owns no Discord connection or token — it emits this frame; a surface renders it. Spec ref: release-spec.md §2.1 resumable setup; §2.8 quick-start; model §12 named-step remediation.",
  "x-stability": "stable",
  "x-schema-version": "1.0.0",
  "type": "object",
  "additionalProperties": false,
  "required": ["schema_version", "generated_for", "done", "title", "progress", "body", "actions"],
  "properties": {
    "schema_version": {
      "description": "The frame contract version. A surface pins to this to detect a frame shape it does not understand.",
      "type": "integer",
      "minimum": 1
    },
    "generated_for": {
      "description": "The step this frame addresses: a checkpoint id, or 'done' for the terminal operational frame.",
      "type": "string",
      "enum": ["C0", "C1", "C2", "C3", "C4", "done"]
    },
    "done": {
      "description": "True when the whole C0–C4 ladder passes and the project is operational.",
      "type": "boolean"
    },
    "title": {
      "type": "string",
      "minLength": 1
    },
    "headline": {
      "description": "A one-sentence 'where you are' summary for terse surfaces.",
      "type": ["string", "null"]
    },
    "progress": { "$ref": "#/$defs/progress" },
    "body": {
      "description": "Plain-language explanation lines for this step (renderer joins with newlines).",
      "type": "array",
      "items": { "type": "string" }
    },
    "todo": {
      "description": "Outstanding work: the owning checkpoint verifier's failing checks, each with its named remediation.",
      "type": "array",
      "items": { "$ref": "#/$defs/todoItem" }
    },
    "satisfied": {
      "description": "The verifier's passing checks for this step (momentum signal).",
      "type": "array",
      "items": { "$ref": "#/$defs/checkSummary" }
    },
    "skipped": {
      "description": "The verifier's non-failing skip checks (deferrable-until-LIVE items).",
      "type": "array",
      "items": { "$ref": "#/$defs/checkSummary" }
    },
    "actions": {
      "description": "The actions available now. A surface renders these as numbered commands (CLI) or buttons (Discord).",
      "type": "array",
      "items": { "$ref": "#/$defs/action" }
    },
    "next_command": {
      "description": "The single most useful command string for this frame, or null.",
      "type": ["string", "null"]
    },
    "just_passed": {
      "description": "Checkpoints confirmed-passing during this compute walk (the advancement signal).",
      "type": "array",
      "items": { "type": "string", "enum": ["C0", "C1", "C2", "C3", "C4"] }
    },
    "doc": {
      "description": "A repo-relative doc path with more detail, or null.",
      "type": ["string", "null"]
    },
    "note": {
      "description": "An optional advisory (e.g. CONTENT_HOME-unset progress-not-saved notice), or null.",
      "type": ["string", "null"]
    },
    "media_models": {
      "description": "OPTIONAL media-model detection (attached to the C4/media frame and the done frame): which §12.5 provider seams (vision / image-gen / video) are configured. All optional; absent ones degrade to skip. Never carries a credential value — only the env-var NAME.",
      "type": "object",
      "additionalProperties": false,
      "required": ["summary", "any_configured", "visual", "image_gen", "video"],
      "properties": {
        "summary": { "type": "string" },
        "any_configured": { "type": "boolean" },
        "visual": { "$ref": "#/$defs/providerStatus" },
        "image_gen": { "$ref": "#/$defs/providerStatus" },
        "video": { "$ref": "#/$defs/providerStatus" }
      }
    }
  },
  "$defs": {
    "providerStatus": {
      "type": "object",
      "additionalProperties": false,
      "required": ["configured"],
      "properties": {
        "capability": { "type": "string", "enum": ["visual", "image_gen", "video"] },
        "configured": { "type": "boolean" },
        "kind": { "type": ["string", "null"], "enum": ["cli", "http", null] },
        "model": { "type": ["string", "null"] },
        "endpoint_env": { "type": ["string", "null"] },
        "source": { "type": ["string", "null"] }
      }
    },
    "progress": {
      "type": "object",
      "additionalProperties": false,
      "required": ["project_state", "done", "total", "checkpoints"],
      "properties": {
        "project_state": {
          "type": "string",
          "enum": ["uninitialized", "ingested", "calibrated", "operational", "paused"]
        },
        "done": { "type": "integer", "minimum": 0 },
        "total": { "type": "integer", "minimum": 1 },
        "checkpoints": {
          "type": "array",
          "items": {
            "type": "object",
            "additionalProperties": false,
            "required": ["id", "label", "status"],
            "properties": {
              "id": { "type": "string", "enum": ["C0", "C1", "C2", "C3", "C4"] },
              "label": { "type": "string" },
              "status": { "type": "string", "enum": ["done", "active", "locked"] }
            }
          }
        }
      }
    },
    "todoItem": {
      "type": "object",
      "additionalProperties": false,
      "required": ["name"],
      "properties": {
        "name": { "type": "string" },
        "detail": { "type": ["string", "null"] },
        "remediation": { "type": ["string", "null"] }
      }
    },
    "checkSummary": {
      "type": "object",
      "additionalProperties": false,
      "required": ["name"],
      "properties": {
        "name": { "type": "string" },
        "detail": { "type": ["string", "null"] }
      }
    },
    "action": {
      "type": "object",
      "additionalProperties": false,
      "required": ["id", "type", "label"],
      "properties": {
        "id": { "type": "string", "minLength": 1 },
        "type": {
          "type": "string",
          "enum": ["run", "input", "choice", "verify", "finish", "link"]
        },
        "label": { "type": "string", "minLength": 1 },
        "help": { "type": "string" },
        "command": { "type": "string" },
        "spends": {
          "description": "True when the action costs engine-metered money — the surface MUST surface the estimate-and-confirm gate (DD-18). The engine never auto-spends behind an action.",
          "type": "boolean"
        },
        "doc": { "type": "string" },
        "inputs": {
          "type": "array",
          "items": {
            "type": "object",
            "additionalProperties": false,
            "required": ["name", "label", "kind"],
            "properties": {
              "name": { "type": "string", "minLength": 1 },
              "label": { "type": "string" },
              "kind": { "type": "string", "enum": ["path", "text", "id", "json"] },
              "required": { "type": "boolean" }
            }
          }
        },
        "options": {
          "type": "array",
          "items": {
            "type": "object",
            "additionalProperties": false,
            "required": ["id", "label"],
            "properties": {
              "id": { "type": "string", "minLength": 1 },
              "label": { "type": "string" },
              "help": { "type": "string" },
              "command": { "type": "string" },
              "spends": { "type": "boolean" }
            }
          }
        }
      }
    }
  }
}
